id,title,description,url,start_time,end_time,venue_id,venue_details
1250476818,PDXWIT Presents: March Happy Hour,"***Registration through Eventbrite (https://www.eventbrite.com/e/pdxwit-presents-march-happy-hour-tickets-94745368949) is required to gain entry to this event ***\r\n\r\nJoin us for Happy Hour at Autodesk on March 18th!\r\n\r\nWe spend quite a bit of time at work, so why not create a community and a work culture that supports meaningful relationships? This month’s theme is Work, Culture and Community. To facilitate this discussion our conversation starter will be: What is one positive way to create a positive work culture?\r\n\r\nWhile the event is primarily intended for networking, we will have a short segment at 5:30 to share important announcements and showcase three women in our community.\r\n-- An employee of Autodesk will provide an introduction to the company and share open job opportunities.\r\n-- Anusha Neelam, PDXWIT Scholarship recipient will talk about developing relationships at work and in the community\r\n-- Paris Hyun, PDXWIT Scholarship recipient, will talk about creating the work culture we deserve\r\n\r\nDuring the event, we’ll have more to do than free-form networking:\r\n-- An Activity Table where people can get creative. This is a fantastic way to meet others if large groups are not your thing; if you have trouble finding it, look for Meg Aul, our Event Activities Director\r\n-- A PDXWIT volunteer opportunities table\r\n-- A section for job seekers and our sponsors who are hiring, to ensure people get connected\r\n\r\nParents: PDXWIT has teamed up with DivCarePDX to provide caregiver services for kids ages 2-13! We have a limited number of tickets available and if you would like to register your child for childcare, please contact: hazel@pdxwit.org for information. You can also bring children and opt out of the childcare portion, as long as the children stick with you throughout the night.\r\n\r\nAgenda:\r\n4:30 p.m. - Doors open/Networking\r\n5:30 p.m. - Introductions, Announcements + Lightning Speakers\r\n6:30 p.m. - Event ends\r\n\r\nEvent FAQ:\r\n\r\nQ: Will there be gender neutral restrooms?\r\nA: Anyone is free to use any restroom that they are comfortable using. We do have gender neutral restrooms located on the 5th floor that guests are welcome to use. They would need to be accompanied by an Autodesk employee as they are not located in a public space.\r\n\r\nQ: Is the space ADA accessible?\r\nA: Yes\r\n\r\nQ: Will there be food and drink at this event?\r\nA: Yes. We will provide light appetizers, beer, wine and soft drinks. We will provide\r\nvegan and GF options.\r\n\r\nQ: What is the parking situation?\r\nA: We do not have onsite parking.\r\n\r\nQ: Is there any special information that might help me find the entrance?\r\nA: All guests must enter and exit through our front door located between 2nd and 3rd\r\non Ankeny. All guests will need to sign in at the front desk and sign an NDA.\r\n\r\nQ: Is there secured bike parking?\r\nA: Yes, we can provide bike parking.\r\nQ: Should I consider using public transportation?\r\nA: YES! There is a street car and bus line stop very close to our office.\r\n\r\nQ: Can I bring my dog?\r\nA: No, we ask that you leave your furry friend home.\r\n\r\nPurpose:\r\nPDXWIT is a community-based non-profit organization. Our purpose is to strengthen the Portland women in tech community by offering educational programs, partnerships, mentorships, resources and opportunities. We are unifying a supportive environment for current and potential women in tech, all of whom are committed to helping each other. Our goal is to bring together and empower women in tech and to encourage others to pursue tech careers. This is our step towards reducing the gender imbalance in the industry and addressing the current negative effects of that imbalance on women.\r\n\r\nOur events are inclusive. ALL people who support our purpose are welcome.",http://pdxwit.org,2020-03-18T16:30:00.000-07:00,2020-03-18T18:30:00.000-07:00,202396074,
1250476838,Portland OWASP - Kendra Ash - Security Mixer!,"Join us for a night of networking and discussion about security. Kendra will kick it off with a short talk about how to make friends with your developers through automation. Then we will split up into groups and allow people to discuss cloud security, application security, devops and jobs.\r\n\r\nBio: Kendra Ash (@securelykash) is a security engineer at Vacasa, actively building out an application security program by leveraging guidance from her network and incorporating industry standards. She is also actively involved with the Portland OWASP chapter.\r\n\r\nRSVP: https://www.meetup.com/OWASP-Portland-Chapter/events/268903220/\r\n",,2020-03-18T18:00:00.000-07:00,2020-03-18T20:00:00.000-07:00,202392091,
1250476790,One-on-One Community Tech Appointment,"Have a Computer Question?\r\nBook today for one-on-one tech help! Learn valuable computer skills, find answers to your questions, and get technical advice through an appointment with a Free Geek volunteer mentor. \r\nThis is a free, volunteer-powered service. When registering, you must sign a release to participate.\r\n\r\nDetails and What to Bring:\r\nPlease bring your device (laptop and power cord, or desktop tower only) and request an Equipment Pass when you arrive.\r\nVolunteers may be able to help with smartphones and tablets based on capacity.\r\n\r\nWhat Can I Get Help With?\r\n\r\nUsing your Linux computer\r\nRunning updates\r\nInstalling software\r\nLibreOffice help \r\nAccessing and using the internet\r\nTroubleshoot a computer problem\r\nStart using privacy and safety tools like a password manager or VPN\r\nAnd more!",https://communitytech.eventbrite.com,2020-03-19T10:30:00.000-07:00,2020-03-19T11:30:00.000-07:00,202389965,
1250476791,One-on-One Community Tech Appointment,"Have a Computer Question?\r\nBook today for one-on-one tech help! Learn valuable computer skills, find answers to your questions, and get technical advice through an appointment with a Free Geek volunteer mentor. \r\nThis is a free, volunteer-powered service. When registering, you must sign a release to participate.\r\n\r\nDetails and What to Bring:\r\nPlease bring your device (laptop and power cord, or desktop tower only) and request an Equipment Pass when you arrive.\r\nVolunteers may be able to help with smartphones and tablets based on capacity.\r\n\r\nWhat Can I Get Help With?\r\n\r\nUsing your Linux computer\r\nRunning updates\r\nInstalling software\r\nLibreOffice help \r\nAccessing and using the internet\r\nTroubleshoot a computer problem\r\nStart using privacy and safety tools like a password manager or VPN\r\nAnd more!",https://communitytech.eventbrite.com,2020-03-19T11:30:00.000-07:00,2020-03-19T12:30:00.000-07:00,202389965,
1250476788,PIE Demo Day 2020,"At PIE (https://piepdx.com/), we're hard at work, prepping a couple of new batches of startups — through both PIE and PIE Shop — who are eager to tell their stories. So we want to make sure that you're there to hear those stories.\r\n\r\nWe will be holding the next PIE Demo Day on Thursday, March 19, 2020. And we'll be hosting it at our biggest venue yet, Revolution Hall in southeast Portland. As always, we'll be livestreaming the event so folks around the world can take part.\r\n\r\nChildcare will be provided.\r\n\r\nSo if you're interested in attending, please RSVP at your earliest convenience. (Livestream RSVP option as well.)",https://www.eventbrite.com/e/pie-demo-day-2020-tickets-90171576613,2020-03-19T14:00:00.000-07:00,2020-03-19T17:00:00.000-07:00,202395009,
1250476739,Portland CoffeeOps - DevOps Discussions!,"We're a welcoming community of folx who gather to talk about software development + operations (Dev + Ops) tools and culture in downtown Portland. We meet every other Friday at the Puppet office, on the 5th floor. The elevators don't open until 8 am!\r\n\r\nOur Lean Coffee (http://leancoffee.org/) format allows us to talk about a diverse range of topics.\r\n\r\nWe follow the Contributor Covenant code of conduct (https://github.com/CoffeeOps/Seattle/blob/master/code-of-conduct.md).\r\n\r\nAgenda:\r\n8:00 - 8:10 Mingle and generate topics\r\n8:10 - 8:20 Get into groups, introduce and vote on topics\r\n8:20 - 9:15 Discussions\r\n9:15 - 9:30 Takeaways and wrap up",https://www.meetup.com/Portland-DevOps-GroundUp,2020-03-20T08:00:00.000-07:00,2020-03-20T09:30:00.000-07:00,202395593,"The elevators open at 8 am, and we will be on the 5th floor!  We won't start discussions until 8:15 am. Please check-in at the Puppet desk, and put \Lucy Wyman\ or \Ben Ford\ as your host!"
1250476792,Hardware Basics 2,"This workshop is an introduction to computer hardware! Students will identify basic components of desktop and laptop computers, learn what role each part plays, and identify where those parts go inside of a computer. Students will learn what makes a computer a “computer,” and a basic framework for computer safety and troubleshooting.\r\n\r\nNo prior knowledge is necessary, but we recommend taking Fundamentals of a Computer Technician and Hardware Basics 1 first.\r\n\r\nRecommended Prerequisites: Fundamentals of a Computer Technician & Hardware Basics 1\r\n\r\n",https://www.eventbrite.com/e/hardware-basics-2-registration-75038011713,2020-03-20T13:00:00.000-07:00,2020-03-20T15:30:00.000-07:00,202389965,
1250476793,Fundamentals of a Computer Technician,"ESD, bad caps, li-ion, what do they all mean!? Working with electronics can be dangerous for both you and the computer, smartphone, or fancy appliance. Fundamentals of a Computer Technician overviews safety procedures and best practices of how to handle your devices so that you can work on any electronic project!\r\n\r\nNext Step: Hardware Basics 1\r\n\r\n",https://www.eventbrite.com/e/fundamentals-of-a-computer-technician-registration-75048719741,2020-03-21T10:30:00.000-07:00,2020-03-21T12:00:00.000-07:00,202389965,
1250476794,One-on-One Community Tech Appointments,"Have a Computer Question?\r\nBook today for one-on-one tech help! Learn valuable computer skills, find answers to your questions, and get technical advice through an appointment with a Free Geek volunteer mentor. \r\nThis is a free, volunteer-powered service. When registering, you must sign a release to participate.\r\n\r\nDetails and What to Bring:\r\nPlease bring your device (laptop and power cord, or desktop tower only) and request an Equipment Pass when you arrive.\r\nVolunteers may be able to help with smartphones and tablets based on capacity.\r\n\r\nWhat Can I Get Help With?\r\n\r\nUsing your Linux computer\r\nRunning updates\r\nInstalling software\r\nLibreOffice help \r\nAccessing and using the internet\r\nTroubleshoot a computer problem\r\nStart using privacy and safety tools like a password manager or VPN\r\nAnd more!",https://www.eventbrite.com/e/one-on-one-community-tech-appointments-registration-90039762353,2020-03-21T13:00:00.000-07:00,2020-03-21T14:00:00.000-07:00,202389965,
1250476796,Digital Privacy Primer,"Join us for an important online safety workshop. Learn how digital privacy works (or doesn't!) and learn how to get started with password managers, encrypted communication, email and mobile privacy tools, and more. We all need this information. Everyone is welcome. Come learn with Free Geek!",https://www.eventbrite.com/e/digital-privacy-primer-registration-42599808173,2020-03-21T13:00:00.000-07:00,2020-03-21T15:00:00.000-07:00,202389965,
1250476795,One-on-One Community Tech Appointments,"Have a Computer Question?\r\nBook today for one-on-one tech help! Learn valuable computer skills, find answers to your questions, and get technical advice through an appointment with a Free Geek volunteer mentor. \r\nThis is a free, volunteer-powered service. When registering, you must sign a release to participate.\r\n\r\nDetails and What to Bring:\r\nPlease bring your device (laptop and power cord, or desktop tower only) and request an Equipment Pass when you arrive.\r\nVolunteers may be able to help with smartphones and tablets based on capacity.\r\n\r\nWhat Can I Get Help With?\r\n\r\nUsing your Linux computer\r\nRunning updates\r\nInstalling software\r\nLibreOffice help \r\nAccessing and using the internet\r\nTroubleshoot a computer problem\r\nStart using privacy and safety tools like a password manager or VPN\r\nAnd more!",https://www.eventbrite.com/e/one-on-one-community-tech-appointments-registration-90039762353,2020-03-21T14:00:00.000-07:00,2020-03-21T15:00:00.000-07:00,202389965,
1250476590,"Open Source Peer Mentoring (Monday Python, for Python JavaScript, Django, React and all open source)","We normally have 12- 24 attendees - some people register on Meetup, others show up every week or see the event on Calagator. All are welcome. Pizza and beverages are served. Parking is free!\r\n\r\nBring your laptop. Learn and/or share your existing knowledge with others. This group focuses on Python, Django, JavaScript, jQuery, SQL, CSS and HTML. Other languages are welcome.\r\n\r\nThis week we will do introductions at 6:20 then pair up mentors and learners and/or work on projects.\r\n\r\nSet aside one night a week to become a better developer, pick up new skills, and get help with your projects and learning. We'll have mentors on hand and a community of other learners to meet and work with.\r\n\r\nThis event is beginner friendly, we can help get you started with programming, support your online learning, or just talk about where you are at and what comes next.\r\n\r\nFree parking! Save this number in case you need help finding us: (541) 602-6215 We are at 2828 SW Corbett Ave #208, inside the Portland State Business Accelerator, and near the International School.",https://www.meetup.com/Portland-Programmer-Network/events/mbpkqlywdbkc/,2020-03-23T18:00:00.000-07:00,2020-03-23T21:30:00.000-07:00,202395100,In the PSU Business Accelerator in Suite 208. Free Parking!\r\n
1250476797,One-on-One Community Tech Appointments,"Have a Computer Question?\r\nBook today for one-on-one tech help! Learn valuable computer skills, find answers to your questions, and get technical advice through an appointment with a Free Geek volunteer mentor. \r\nThis is a free, volunteer-powered service. When registering, you must sign a release to participate.\r\n\r\nDetails and What to Bring:\r\nPlease bring your device (laptop and power cord, or desktop tower only) and request an Equipment Pass when you arrive.\r\nVolunteers may be able to help with smartphones and tablets based on capacity.\r\n\r\nWhat Can I Get Help With?\r\n\r\nUsing your Linux computer\r\nRunning updates\r\nInstalling software\r\nLibreOffice help \r\nAccessing and using the internet\r\nTroubleshoot a computer problem\r\nStart using privacy and safety tools like a password manager or VPN\r\nAnd more!",https://www.eventbrite.com/e/one-on-one-community-tech-appointments-registration-90039762353,2020-03-24T15:30:00.000-07:00,2020-03-24T16:30:00.000-07:00,202389965,
1250476798,One-on-One Community Tech Appointments,"Have a Computer Question?\r\nBook today for one-on-one tech help! Learn valuable computer skills, find answers to your questions, and get technical advice through an appointment with a Free Geek volunteer mentor. \r\nThis is a free, volunteer-powered service. When registering, you must sign a release to participate.\r\n\r\nDetails and What to Bring:\r\nPlease bring your device (laptop and power cord, or desktop tower only) and request an Equipment Pass when you arrive.\r\nVolunteers may be able to help with smartphones and tablets based on capacity.\r\n\r\nWhat Can I Get Help With?\r\n\r\nUsing your Linux computer\r\nRunning updates\r\nInstalling software\r\nLibreOffice help \r\nAccessing and using the internet\r\nTroubleshoot a computer problem\r\nStart using privacy and safety tools like a password manager or VPN\r\nAnd more!",https://www.eventbrite.com/e/one-on-one-community-tech-appointments-registration-90039762353,2020-03-24T16:30:00.000-07:00,2020-03-24T17:30:00.000-07:00,202389965,
1250476799,Programming with Python 2,"Have you ever thought programming was interesting, but don't know where to start? Do you want to unlock the true potential of computers? Join us! \r\n\r\nThis class is part 2 of an introduction to programming concepts with Python, an easy-to-learn programming language. If you can type, you can program!",https://www.eventbrite.com/e/programming-with-python-2-registration-44715055936,2020-03-25T10:30:00.000-07:00,2020-03-25T13:00:00.000-07:00,202389965,
1250476771,PDXWIT Presents: Building Equity with Mindfulness,"***Registration through Eventbrite (https://www.eventbrite.com/e/pdxwit-presents-building-equity-in-tech-mindfulness-human-skills-tickets-93218387707) is required to gain entry to this event ***\r\n\r\nJoin us for a powerful talk on “human skills” and how to build equity in tech through empathy and self-awareness with featured speaker Del Likins (https://www.linkedin.com/in/mxlikins/) of BeginWithin (http://www.beginwith.in).  Del will cover the following key topics:\r\n-- Ego’s inclination for self-centeredness, and the practice of “centering” other voices\r\n-- Mindfulness for holding discomfort and difference\r\n-- “The power of pause” and what to do with the impulse to fix\r\n-- Ego habits common in methods of oppression: silencing, filling the space, explaining\r\n-- Mindful habits common in building equity: allowing for discomfort, deep listening and skillful responses\r\n\r\nAgenda:\r\n5:30 p.m. - Doors open \r\n6:15 p.m. - PDXWIT and Kindercare Education Introduction \r\n6:30 p.m. - Presentation and Q & A\r\n7:15 p.m. - Networking\r\n7:30 p.m. Event ends\r\n\r\nEvent FAQ\r\nQ: Will there be gender neutral restrooms?\r\nA: No.\r\n\r\nQ: Is the space ADA accessible? \r\nA: Yes.\r\n\r\nQ: Will there be food and drink at this event? \r\nA: Yes.\r\n\r\nQ: What is the parking situation? \r\nA: Street parking and a pay garage in the building.\r\n\r\nQ: Is there any special information that might help me find the entrance?\r\nA: There are entrances on either side of the building. There will be signs in the main lobby directing attendees to the event.\r\n\r\nQ: Is there secured bike parking?\r\nA: There are bike racks behind the building.\r\n\r\nQ: Should I consider using public transportation?\r\nA: Yes! Max, Bus, and Streetcar stops are all outside the front door. \r\n\r\nQ: Can I bring my dog?\r\nA: No, we ask that you leave your furry friend home. Please note there may be office pets present at this event.\r\n\r\nPurpose:\r\nPDXWIT is a community-based non-profit organization. Our purpose is to strengthen the Portland women in tech community by offering educational programs, partnerships, mentorships, resources and opportunities. We are unifying a supportive environment for current and potential women in tech, all of whom are committed to helping each other. Our goal is to bring together and empower women in tech and to encourage others to pursue tech careers. This is our step towards reducing the gender imbalance in the industry and addressing the current negative effects of that imbalance on women.\r\n\r\nOur events are inclusive. ALL people who support our purpose are welcome.\r\n",http://pdxwit.org,2020-03-25T17:30:00.000-07:00,2020-03-25T19:30:00.000-07:00,202396089,
1250476800,Advanced Command Line: Intro to Shell Scripting,"Control your computer, make your own programs, and make timed actions for your programs by learning to shell script. Command line knowledge required.",https://introshellscripting.eventbrite.com,2020-03-27T10:30:00.000-07:00,2020-03-27T12:30:00.000-07:00,202389965,
1250476801,Command Line Basics,"The command line is a tool for typing computer commands, instead of clicking menus or buttons.\r\n\r\nLearning the command line is a great way to get familiar with core concepts of programming. Students will learn the basic parts of a command, listing, linking, tab completion, file system structure, and more, for the Linux command line.",https://www.eventbrite.com/e/command-line-basics-registration-44712393974,2020-03-28T10:30:00.000-07:00,2020-03-28T12:30:00.000-07:00,202389965,
1250476675,Speech Recognition Systems,"Join us as Nick Williams gives an overview of how speech-recognition systems are created and how they work.\r\n\r\nNick is originally from Florida, with a BA and MA in linguistics. He works for the speech-recognition software company Sensory as a linguistic technologist. This will be a \non-technical overview\ with lots of moving parts.\r\n\r\nIn the first 30 minutes, we'll have the presentation. The second 30 minutes we'll spend with Q&A and networking.\r\n\r\nBe inspired!\r\nKnowledge Mavens",https://www.meetup.com/KnowledgeMavens/events/nnfnmrybcdblb/,2020-03-28T11:00:00.000-07:00,2020-03-28T12:00:00.000-07:00,202396020,"Look for PCC Sign - Enter these GPS coordinates Google Maps - 45.468688, -122.775950"
1250476591,"Open Source Peer Mentoring (Monday Python, for Python JavaScript, Django, React and all open source)","We normally have 12- 24 attendees - some people register on Meetup, others show up every week or see the event on Calagator. All are welcome. Pizza and beverages are served. Parking is free!\r\n\r\nBring your laptop. Learn and/or share your existing knowledge with others. This group focuses on Python, Django, JavaScript, jQuery, SQL, CSS and HTML. Other languages are welcome.\r\n\r\nThis week we will do introductions at 6:20 then pair up mentors and learners and/or work on projects.\r\n\r\nSet aside one night a week to become a better developer, pick up new skills, and get help with your projects and learning. We'll have mentors on hand and a community of other learners to meet and work with.\r\n\r\nThis event is beginner friendly, we can help get you started with programming, support your online learning, or just talk about where you are at and what comes next.\r\n\r\nFree parking! Save this number in case you need help finding us: (541) 602-6215 We are at 2828 SW Corbett Ave #208, inside the Portland State Business Accelerator, and near the International School.",https://www.meetup.com/Portland-Programmer-Network/events/mbpkqlywdbkc/,2020-03-30T18:00:00.000-07:00,2020-03-30T21:30:00.000-07:00,202395100,In the PSU Business Accelerator in Suite 208. Free Parking!\r\n
1250476807,Portland Elm Meetup - March Presentations & study group,"March presentations:\r\n\r\n* Brian: 10–15 mins on Minima, a web audio playground written in Elm\r\n* Jesse: 10–15 mins on creating an X-Ray style video app in Elm\r\n\r\nThis will be followed signup for April presentations and an optional roundtable study group.\r\n\r\nAttendees of the study group will share what they’ve learned so far, what they struggled with or are stuck on, and what they intend to accomplish in the next month.",https://www.meetup.com/Portland-Elm-Meetup/events/268632752,2020-03-30T18:00:00.000-07:00,2020-03-30T19:30:00.000-07:00,202395374,Please do not use the call box. Arrive promptly to be let upstairs with the group. Message the host via Meetup if you are late and need to be let up.
1250476806,PDXWIT Presents: Imposter Syndrome and Why You are Good Enough,"***Registration through Eventbrite (eventbrite.com/e/pdxwit-presents-imposter-syndrome-and-why-you-are-good-enough-tickets-94225339527)  is required to gain entry to this event ***\r\n\r\nAlmost all of us at some time or another has looked around us and thought \oh no, I don't belong here.\ In this talk we're going to discuss this feeling—imposter syndrome—that silently plagues us in our day-to-day lives. What is it? Why does it happen? How do we go about dealing with it? Can we make it go away? Join our speaker Aurora Shido-Wagenet as she walks through the science and discussion around these questions, and hopefully walk away with tools you can use to combat imposter syndrome.\r\n\r\nAurora Shido-Wagenet (https://www.linkedin.com/in/juniperxandxlamplight/) is an Associate Software Engineer at Zapproved here in Portland with a passion for psychology and supporting the Portland tech community. \r\n\r\nAgenda:\r\n5:30 p.m. - Doors open\r\n6:00 p.m. - PDXWIT and Speaker Introduction\r\n6:15 p.m. - Presentation / Q&A\r\n7:00 p.m. - Networking\r\n7:30 p.m. - Event Ends\r\n\r\n\r\nEvent FAQ\r\nQ: Will there be gender neutral restrooms?\r\nA: Yes.\r\n\r\nQ: Is the space ADA accessible? \r\nA: Yes.\r\n\r\nQ: Will there be food and drink at this event? \r\nA: Yes.\r\n\r\nQ: What is the parking situation? \r\nA: Metered street parking only.\r\n\r\nQ: Is there any special information that might help me find the entrance?\r\nA: The building entrance is on Morrison. \r\n\r\nQ: Is there secured bike parking?\r\nA: No.\r\n\r\nQ: Should I consider using public transportation?\r\nA: Yes.\r\n\r\nQ: Can I bring my dog?\r\nA: No, we ask that you leave your furry friend home. \r\n\r\nPurpose:\r\nPDXWIT is a community-based non-profit organization. Our purpose is to strengthen the Portland women in tech community by offering educational programs, partnerships, mentorships, resources and opportunities. We are unifying a supportive environment for current and potential women in tech, all of whom are committed to helping each other. Our goal is to bring together and empower women in tech and to encourage others to pursue tech careers. This is our step towards reducing the gender imbalance in the industry and addressing the current negative effects of that imbalance on women.\r\n\r\nOur events are inclusive. ALL people who support our purpose are welcome.\r\n\r\n\r\n",http://pdxwit.org,2020-03-31T17:30:00.000-07:00,2020-03-31T19:30:00.000-07:00,202396479,
