id,title,description,url,start_time,end_time,venue_id,venue_details
1250476828,@DAMAPDX Kafka Fundaments with Brian Walter from Confluent,"Presented by Brian Walter\r\nConfluent\r\nIncludes a demo and extended Q&A session\r\n\r\nWhen\r\n\r\nMarch 4th, 2020\r\n\r\nSchedule\r\n\r\n8:30 – 9:00 – Snacks and warm-up\r\n9:00 – 10:30 – Presentation\r\n\r\nStandard Insurance Tower Atrium (900 SW 5th, please note Standard Ins. has multiple downtown locations)\r\n\r\nCost\r\n\r\nFree for members (including ALL employees of corporate members)\r\n$15 for non-members\r\n$5 for students with valid student ID",https://damapdx.org/2020/02/12/save-the-date-march-4th-kafka-fundamentals/,2020-03-04T20:30:00.000-08:00,2020-03-04T22:30:00.000-08:00,202395985,"Standard Insurance Center, 900 SW 5th Ave, Portland, OR 97204, USA"
1250476775,One-on-One Community Tech Appointment,"Have a Computer Question?\r\nBook today for one-on-one tech help! Learn valuable computer skills, find answers to your questions, and get technical advice through an appointment with a Free Geek volunteer mentor. \r\nThis is a free, volunteer-powered service. When registering, you must sign a release to participate.\r\n\r\nDetails and What to Bring:\r\nPlease bring your device (laptop and power cord, or desktop tower only) and request an Equipment Pass when you arrive.\r\nVolunteers may be able to help with smartphones and tablets based on capacity.\r\n\r\nWhat Can I Get Help With?\r\n\r\nUsing your Linux computer\r\nRunning updates\r\nInstalling software\r\nLibreOffice help \r\nAccessing and using the internet\r\nTroubleshoot a computer problem\r\nStart using privacy and safety tools like a password manager or VPN\r\nAnd more!",https://communitytech.eventbrite.com,2020-03-05T10:30:00.000-08:00,2020-03-05T11:30:00.000-08:00,202389965,
1250476776,One-on-One Community Tech Appointment,"Have a Computer Question?\r\nBook today for one-on-one tech help! Learn valuable computer skills, find answers to your questions, and get technical advice through an appointment with a Free Geek volunteer mentor. \r\nThis is a free, volunteer-powered service. When registering, you must sign a release to participate.\r\n\r\nDetails and What to Bring:\r\nPlease bring your device (laptop and power cord, or desktop tower only) and request an Equipment Pass when you arrive.\r\nVolunteers may be able to help with smartphones and tablets based on capacity.\r\n\r\nWhat Can I Get Help With?\r\n\r\nUsing your Linux computer\r\nRunning updates\r\nInstalling software\r\nLibreOffice help \r\nAccessing and using the internet\r\nTroubleshoot a computer problem\r\nStart using privacy and safety tools like a password manager or VPN\r\nAnd more!",https://communitytech.eventbrite.com,2020-03-05T11:30:00.000-08:00,2020-03-05T12:30:00.000-08:00,202389965,
1250476028,Accelerate Biotech & Digital Health Happy Hour,"Please join us for our July Accelerate Biotech & Digital Health PDX Happy Hour at the Oregon Bioscience Incubator (OBI) / OTRADI!\r\n\r\nCome mingle with your fellow biotech and digital health enthusiasts, help build community, and share your ideas on how to further accelerate the growth of these promising sectors in Portland.\r\n\r\nThese happy hours brings together creative and driven professionals who are passionate about promoting the growth of Portland's Biotech and Digital Health sectors. This is a great opportunity to network and build relationships with individuals working across these sectors in both academia and industry. Enjoy a free drink, build community, and contribute your ideas and efforts towards accelerating Biotech and Digital Health in PDX.",,2020-03-05T17:30:00.000-08:00,2020-03-05T19:00:00.000-08:00,202396070,"Although we have some parking onsite, it is limited and not guaranteed. We recommend taking public transportation in the form of bus (bus 35 drops off on Macadam and we are a block down the road) or streetcar. The streetcar is less than a 10 minute walk from our location."
1250476822,Women Who Code Portland - International Women's Day @ Nike,"Join Women Who Code Portland on March 5th as we celebrate International Women’s Day at Nike! We are thrilled to invite you to a fun evening including a panel discussion on breaking barriers for women in tech, networking, and food + drinks. Women at Nike will discuss their experiences and the steps they have taken to move past barriers themselves and remove barriers for other women in tech. Come enjoy food, great swag and the company of your fellow technologists!\r\n\r\n⌚️ Agenda ⌚️\r\n\r\n5:30pm - 6:00pm - Doors Open + Networking\r\n6:00pm - 6:15pm - Introduction from WWCode\r\n6:15pm - 6:30pm - Welcome from Nike - Ratnakar Lavu, Chief Digital Information Officer\r\n6:30pm - 7:30pm - Panel led by moderator Tricia Radcliffe, Director, WWCode Portland\r\n7:30pm - 7:45pm - Closing remarks - Skip Potter, CTO & VP of Serve, Nike\r\n7:45pm - 8:00pm - Raffle Announcement - Laurie Basset, Sr Director, Digital Engineering, Nike & Owyn Richen, Sr Director - Platform Development, Nike\r\n8:00pm - 8:30pm - Networking + Wrap Up\r\n\r\n👩🏽 Our Panelists 👩🏽\r\n\r\n- Candice Tang - Senior Director, Reliability Engineering\r\n- Hollie Newton - Vice President, Reliability\r\n- Kendra Elford - Sr Software Manager\r\n- Tricia Radcliffe - Moderator - Director, WWCode Portland\r\n\r\n✨ Code of Conduct ✨\r\n\r\nWWCode is an inclusive community, dedicated to providing an empowering experience for everyone who participates in or supports our community, regardless of gender, gender identity and expression, sexual orientation, ability, physical appearance, body size, race, ethnicity, age, religion, socioeconomic status, caste or creed. Our events are intended to inspire women to excel in technology careers, and anyone who is there for this purpose is welcome. We do not tolerate harassment of members in any form.\r\n\r\nOur Code of Conduct (http://www.womenwhocode.com/codeofconduct) applies to all WWCode events and online communities. If you would like to report an incident, please reach out to one of our volunteers or submit an incident report form: http://bit.ly/wwcode-incident-report.\r\n\r\n",https://wwcodepdx-iwd2020-nike.eventbrite.com,2020-03-05T17:30:00.000-08:00,2020-03-05T20:30:00.000-08:00,202394785,"Q: Is the space ADA accessible?\r\n\r\nA: Yes.\r\n\r\nQ: Will there be gender neutral restrooms?\r\n\r\nA: Yes.\r\n\r\nQ: How do I get to the venue?\r\n\r\nA. Please see this PDF for detailed directions to the venue: https://drive.google.com/file/d/15dhYf9mnkSJHYz1qyphc7E0NwK4fVH-H/view\r\n\r\nQ: Will there be food and drinks at this event?\r\n\r\nA: Yes, there will be food."
1250476738,Portland CoffeeOps - DevOps Discussions!,"We're a welcoming community of folx who gather to talk about software development + operations (Dev + Ops) tools and culture in downtown Portland. We meet every other Friday at the Puppet office, on the 5th floor. The elevators don't open until 8 am!\r\n\r\nOur Lean Coffee (http://leancoffee.org/) format allows us to talk about a diverse range of topics.\r\n\r\nWe follow the Contributor Covenant code of conduct (https://github.com/CoffeeOps/Seattle/blob/master/code-of-conduct.md).\r\n\r\nAgenda:\r\n8:00 - 8:10 Mingle and generate topics\r\n8:10 - 8:20 Get into groups, introduce and vote on topics\r\n8:20 - 9:15 Discussions\r\n9:15 - 9:30 Takeaways and wrap up",https://www.meetup.com/Portland-DevOps-GroundUp,2020-03-06T08:00:00.000-08:00,2020-03-06T09:30:00.000-08:00,202395593,"The elevators open at 8 am, and we will be on the 5th floor!  We won't start discussions until 8:15 am. Please check-in at the Puppet desk, and put \Lucy Wyman\ or \Ben Ford\ as your host!"
1250476777,Hardware Basics 1 -- Great for kids!,"This workshop is an introduction to computer hardware. Students will identify basic components of a desktop and laptop computer, learn what role each part plays, and identify where those parts go inside the computer. Students learn what makes a computer “a computer” and a basic framework for computer safety and troubleshooting. \r\n\r\nNo prior knowledge is necessary.\r\n\r\n",https://www.eventbrite.com/e/hardware-basics-1-registration-69217534509,2020-03-06T13:00:00.000-08:00,2020-03-06T15:30:00.000-08:00,202389965,
1250476754,Global Legal Hackathon,Develop tech tools and startup ideas to facilitate access to justice and progress the business of law.,https://globallegalhackathon.com/,2020-03-06T16:00:00.000-08:00,2020-03-08T19:00:00.000-07:00,202391320,
1250476778,Hardware Basics 2,"This workshop is an introduction to computer hardware! Students will identify basic components of desktop and laptop computers, learn what role each part plays, and identify where those parts go inside of a computer. Students will learn what makes a computer a “computer,” and a basic framework for computer safety and troubleshooting.\r\n\r\nNo prior knowledge is necessary, but we recommend taking Fundamentals of a Computer Technician and Hardware Basics 1 first.\r\n\r\nRecommended Prerequisites: Fundamentals of a Computer Technician & Hardware Basics 1\r\n\r\n",https://www.eventbrite.com/e/hardware-basics-2-registration-75038011713,2020-03-07T10:30:00.000-08:00,2020-03-07T12:30:00.000-08:00,202389965,
1250476779,Simple 3D Animation in Blender,"Blender is a free, open source 3D creation suite. This class is an introduction to Blender. Learn how to navigate within Blender, create and edit simple 3D models, and add basic lighting to your art. Take this class as many times as you'd like. Bring a project—there will be plenty of time to work on it!\r\n\r\n",https://www.eventbrite.com/e/simple-3d-animation-with-blender-tickets-55984992620,2020-03-07T13:00:00.000-08:00,2020-03-07T15:00:00.000-08:00,202389965,
1250476780,Hardware Basics 1 -- Great for kids!,"This workshop is an introduction to computer hardware. Students will identify basic components of a desktop and laptop computer, learn what role each part plays, and identify where those parts go inside the computer. Students learn what makes a computer “a computer” and a basic framework for computer safety and troubleshooting. \r\n\r\nNo prior knowledge is necessary.\r\n\r\n",https://www.eventbrite.com/e/hardware-basics-1-registration-69217534509,2020-03-07T15:00:00.000-08:00,2020-03-07T17:30:00.000-08:00,202389965,
1250476825,GRAND OPENING,"\r\n\r\nWe are proud of our food in Oregon. So why is all of our Pasta prepackaged noodles, frozen/canned sauces and precooked meats? We believe Oregonians deserve real pasta. Love Pasta will do it differently: Pastas Noodles made daily from scratch, sauces made daily from a small list of fresh, simple ingredients, and our meats are real cuts, cooked to order and never precooked. This is our commitment to Oregonians and we will work hard to keep it all at a price everyone can be happy with. Come to the cart and say hi, and help us have a fantastic Grand Opening on the 9th, and all week long! Be one of the fisrt to try Beavertons Newest food cart. Visit our website lovepasta.info to sign up as a pastaholic for updates and deals, or checkout our facebook for updates as we head into grand opening week! @Love pasta",http://lovepasta.info,2020-03-09T11:30:00.000-07:00,2020-03-09T22:00:00.000-07:00,202396484,Plenty of seating for all grab a beer while you wait for and enjoy your pasta. 
1250476587,"Open Source Peer Mentoring (Monday Python, for Python JavaScript, Django, React and all open source)","We normally have 12- 24 attendees - some people register on Meetup, others show up every week or see the event on Calagator. All are welcome. Pizza and beverages are served. Parking is free!\r\n\r\nBring your laptop. Learn and/or share your existing knowledge with others. This group focuses on Python, Django, JavaScript, jQuery, SQL, CSS and HTML. Other languages are welcome.\r\n\r\nThis week we will do introductions at 6:20 then pair up mentors and learners and/or work on projects.\r\n\r\nSet aside one night a week to become a better developer, pick up new skills, and get help with your projects and learning. We'll have mentors on hand and a community of other learners to meet and work with.\r\n\r\nThis event is beginner friendly, we can help get you started with programming, support your online learning, or just talk about where you are at and what comes next.\r\n\r\nFree parking! Save this number in case you need help finding us: (541) 602-6215 We are at 2828 SW Corbett Ave #208, inside the Portland State Business Accelerator, and near the International School.",https://www.meetup.com/Portland-Programmer-Network/events/mbpkqlywdbkc/,2020-03-09T18:00:00.000-07:00,2020-03-09T21:30:00.000-07:00,202395100,In the PSU Business Accelerator in Suite 208. Free Parking!\r\n
1250476781,One-on-One Community Tech Appointments,"Have a Computer Question?\r\nBook today for one-on-one tech help! Learn valuable computer skills, find answers to your questions, and get technical advice through an appointment with a Free Geek volunteer mentor. \r\nThis is a free, volunteer-powered service. When registering, you must sign a release to participate.\r\n\r\nDetails and What to Bring:\r\nPlease bring your device (laptop and power cord, or desktop tower only) and request an Equipment Pass when you arrive.\r\nVolunteers may be able to help with smartphones and tablets based on capacity.\r\n\r\nWhat Can I Get Help With?\r\n\r\nUsing your Linux computer\r\nRunning updates\r\nInstalling software\r\nLibreOffice help \r\nAccessing and using the internet\r\nTroubleshoot a computer problem\r\nStart using privacy and safety tools like a password manager or VPN\r\nAnd more!",https://www.eventbrite.com/e/one-on-one-community-tech-appointments-registration-90039762353,2020-03-10T15:30:00.000-07:00,2020-03-10T16:30:00.000-07:00,202389965,
1250476782,One-on-One Community Tech Appointments,"Have a Computer Question?\r\nBook today for one-on-one tech help! Learn valuable computer skills, find answers to your questions, and get technical advice through an appointment with a Free Geek volunteer mentor. \r\nThis is a free, volunteer-powered service. When registering, you must sign a release to participate.\r\n\r\nDetails and What to Bring:\r\nPlease bring your device (laptop and power cord, or desktop tower only) and request an Equipment Pass when you arrive.\r\nVolunteers may be able to help with smartphones and tablets based on capacity.\r\n\r\nWhat Can I Get Help With?\r\n\r\nUsing your Linux computer\r\nRunning updates\r\nInstalling software\r\nLibreOffice help \r\nAccessing and using the internet\r\nTroubleshoot a computer problem\r\nStart using privacy and safety tools like a password manager or VPN\r\nAnd more!",https://www.eventbrite.com/e/one-on-one-community-tech-appointments-registration-90039762353,2020-03-10T16:30:00.000-07:00,2020-03-10T17:30:00.000-07:00,202389965,
1250476783,Programming with Python 1,"Have you ever thought programming was interesting, but don't know where to start? Do you want to unlock the true potential of computers? This is the class for you!\r\n\r\nThis class is an introduction to programming concepts with Python, an easy-to-learn programming language. Every class begins with the basics of what Python is and how to use it. After that we'll talk about computer science theory in an approachable way. Finally we'll have a lab where your questions can get answered and you can show off your projects.\r\n\r\nNo prior programming experience required. If you can type, you can program!\r\n\r\nRecommended Follow-up: Programming with Python 2",https://www.eventbrite.com/e/programming-with-python-1-registration-44714899468,2020-03-11T10:30:00.000-07:00,2020-03-11T13:00:00.000-07:00,202389965,
1250476734,PDXWIT Presents: Diversity Dinner (Apply to Attend),"***Registration through Eventbrite [https://www.eventbrite.com/e/pdxwit-presents-diversity-dinner-apply-to-attend-tickets-91073562477] is required to gain entry to this event *** You must apply to attend. Form link is on the Eventbrite description.\r\n\r\nJoin us for a small, informal yet focused dinner where we can share our experiences with diversity in the workplace. The intimate and safe setting will allow us to discuss tactics, strategies and support to resolve the issues that arise. This event will be led by Marcus Carter, Crystal Sincoff, Emma Holland and Zhou Fang.\r\n\r\nOur goal is to ensure this event results in a well-represented, honest and impactful conversation about diversity in our industry, so we are asking folks to apply to attend this event by completing this form. Applications are due by March 3rd and the 10 invitees will be notified by March 6th.\r\n\r\nAgenda:\r\n\r\n6:00 p.m. - Arrive and get food\r\n\r\n6:15 p.m. - Discussion begins\r\n\r\n8:00 p.m. - Event ends\r\n\r\nEvent FAQ\r\n\r\nQ: Will there be gender neutral restrooms?\r\n\r\nA: Yes, we have all gender restrooms.\r\n\r\nQ: Is the space ADA accessible?\r\n\r\nA: Yes, we are ADA compliant.\r\n\r\nQ: Will there be food and drink at this event?\r\n\r\nA: Yes, we will have food provided and can offer gluten free and vegan options.\r\n\r\nQ: What is the parking situation?\r\n\r\nA: No, we do not have on-site parking. There is usually plentiful street parking.\r\n\r\nQ: Is there any special information that might help me find the entrance?\r\n\r\nA: We have a main door and an elevator that lock at specific times. We will request that they remain open for the event.\r\n\r\nQ: Is there secured bike parking?\r\n\r\nA: We have a bike room on our floor for approximately 10 bikes, if this gets full the building has parking on the 3rd floor. This is an indoor parking with lockers. When parking here it is like parking on the street. There is not someone monitoring this area.\r\n\r\nQ: Should I consider using public transportation?\r\n\r\nA: There is a trolley that comes past our building, but it's by no means necessary.\r\n\r\nQ: Can I bring my dog?\r\n\r\nA: No, we ask that you leave your furry friend home.\r\n\r\nPurpose:\r\n\r\nPDXWIT is a community-based non-profit organization. Our purpose is to strengthen the Portland women in tech community by offering educational programs, partnerships, mentorships, resources and opportunities. We are unifying a supportive environment for current and potential women in tech, all of whom are committed to helping each other. Our goal is to bring together and empower women in tech and to encourage others to pursue tech careers. This is our step towards reducing the gender imbalance in the industry and addressing the current negative effects of that imbalance on women.\r\n\r\nOur events are inclusive. ALL people who support our purpose are welcome.",https://www.pdxwit.org,2020-03-11T18:00:00.000-07:00,2020-03-11T20:00:00.000-07:00,202396241,
1250476831,Founders Live PDX,"*** GET YOUR $5 DISCOUNTED TICKETS NOW. AVAILABLE FOR ONE WEEK ONLY... THROUGH 2/24! ***\r\n\r\nFebruary 12th was our best night yet... with an amazing crowd, Nick Hughes in the house, an ever-expanding list of sponsors... and of course 5 simply amazing startups!\r\n\r\nLet's do it again on March 11th... :)\r\n\r\nExcellent networking, food, drink, and awesome startup innovation. Don't miss it!\r\n\r\nOr watch it at: http://watch.founderslive.com",https://www.eventbrite.com/e/founders-live-pdx-wed-311-tickets-95111175085,2020-03-11T18:00:00.000-07:00,2020-03-11T21:00:00.000-07:00,202395356,Register on SW Stark side.
1250476784,Web Development 1,"Please note: Thursday classes are held in the Classroom. Saturday classes are held in the Meeting Room.\r\n\r\nInterested in creating a website, but don't know where to start? Join us at Free Geek for an introduction to the building blocks of the web: HTML and CSS.\r\n\r\nRequired skills: Comfort using a keyboard & mouse\r\n\r\n",https://webdevelopment1.eventbrite.com,2020-03-13T10:30:00.000-07:00,2020-03-13T12:30:00.000-07:00,202389965,
1250476785,Command Line Basics,"The command line is a tool for typing computer commands, instead of clicking menus or buttons.\r\n\r\nLearning the command line is a great way to get familiar with core concepts of programming. Students will learn the basic parts of a command, listing, linking, tab completion, file system structure, and more, for the Linux command line.",https://www.eventbrite.com/e/command-line-basics-registration-44712393974,2020-03-14T10:30:00.000-07:00,2020-03-14T12:30:00.000-07:00,202389965,
1250476683,Beyond Dysfunctional Family Dynamics,"This is one of the \seed\ classes with core fundamental information about the foundations upon which we build our lives. We will look at the roles and dynamics of dysfunctional families, how they can affect you in the present time, and strategies for moving beyond them toward more freedom, love, authenticity, creativity, and productivity. This is a core class to understand the fundamentals of one's emotional foundation.\r\n\r\nThis event is hosted by Dr. Sharon Eve. You can find her amazing meetup at https://www.meetup.com/Topics-in-Psychology/\r\n\r\nDr. Sharon Eve is a retired psychotherapist with more than four decades doing individual, couples, family, and group therapy. She is an international speaker and author and recently moved to Portland after many years in Southern California.\r\n\r\nBe inspired!\r\nKnowledge Mavens",https://www.meetup.com/KnowledgeMavens/events/nnfnmrybcfbsb/,2020-03-14T11:00:00.000-07:00,2020-03-14T12:00:00.000-07:00,202396020,"Look for PCC Sign - Enter these GPS coordinates Google Maps - 45.468688, -122.775950"
1250476787,Make a DJ Push Pad with Raspberry Pi,"Space is limited! Please register only if you are committed to attending.\r\n\r\nBecome a DIY DJ with Raspberry Pi! Come tinker with us using the Raspberry Pi, a powerful open source micro-computer that is revolutionizing the DIY landscape. By writing code and building circuits, you will create and customize a simple DJ push pad (much like the controllers used to make electronic music).\r\n\r\nAll necessary equipment is provided for class, but if you'd like to take it home, you can purchase a kit at the Free Geek Store!\r\n\r\nRecommended Prerequisites: Anatomy of a Computer (call 503-232-9350 to register)",https://raspberrypifreegeek.eventbrite.com,2020-03-14T15:30:00.000-07:00,2020-03-14T17:30:00.000-07:00,202389965,
1250476455,PLUG Linux Clinic,"The Linux Clinic meets once a month on the third Sunday from 1 - 5 pm at Free Geek, 1731 SE 10th Avenue, Portland, 97214.\r\n\r\nBring your Linux computer that is being a brat and we'll teach it some manners. Or bring your computer that has some evil operating system on it and we'll send it home with a shiny, clean Linux distro. Or just come and look over shoulders to see what Linux is all about.\r\n\r\nIf you already know Linux well, the Clinic is also a good place to learn how to help users troubleshoot problems. It's excellent training for tech support work in Linux.\r\n\r\nWe have monitors, mice, keyboards, and miscellanous other perifpherals, so generally all you need to bring is the box.\r\n\r\nThere will also be coffee and people usually bring munchies as well. After all, you can't do computers on an empty tummy.\r\n",http://pdxlinux.org,2020-03-15T13:00:00.000-07:00,2020-03-15T17:00:00.000-07:00,202389965,
1250476588,"Open Source Peer Mentoring (Monday Python, for Python JavaScript, Django, React and all open source)","We normally have 12- 24 attendees - some people register on Meetup, others show up every week or see the event on Calagator. All are welcome. Pizza and beverages are served. Parking is free!\r\n\r\nBring your laptop. Learn and/or share your existing knowledge with others. This group focuses on Python, Django, JavaScript, jQuery, SQL, CSS and HTML. Other languages are welcome.\r\n\r\nThis week we will do introductions at 6:20 then pair up mentors and learners and/or work on projects.\r\n\r\nSet aside one night a week to become a better developer, pick up new skills, and get help with your projects and learning. We'll have mentors on hand and a community of other learners to meet and work with.\r\n\r\nThis event is beginner friendly, we can help get you started with programming, support your online learning, or just talk about where you are at and what comes next.\r\n\r\nFree parking! Save this number in case you need help finding us: (541) 602-6215 We are at 2828 SW Corbett Ave #208, inside the Portland State Business Accelerator, and near the International School.",https://www.meetup.com/Portland-Programmer-Network/events/mbpkqlywdbkc/,2020-03-16T18:00:00.000-07:00,2020-03-16T21:30:00.000-07:00,202395100,In the PSU Business Accelerator in Suite 208. Free Parking!\r\n
1250476803,Monkeys in the Machine (Machine Learning),"Food, learning, sharing and encouragement with the fabulous PHP Community!\r\n\r\nThis month Eric Mann presents Monkeys in the Machine\r\n\r\nCan a million monkeys given a million typewriters produce the collected works of Shakespeare? Considering the ethical concerns of forcing monkeys to write, paired with the sheer mess of that many mammals in one location, we might never know. Or will we?\r\n\r\nThanks to the wonders of modern computing, it's possible to _simulate_ monkeys emulating the Bard. Leveraging techniques like genetic algorithms, we can build a system that approximates a monkey armed with a typewriter. Digitally.\r\n\r\nIt's a fun exercise to prove a thought experiment, but also a powerful technical approach to leverage machine learning and rudimentary AI in various places. Together, we'll breed digital monkeys and show both how they can be used to answer the aforementioned Shakespearean question as well as produce generative results to more _practical_ problems.",https://www.meetup.com/PDX-PHP,2020-03-17T18:00:00.000-07:00,2020-03-17T21:00:00.000-07:00,202395308,
